{
 "job_id": "fixture-mayur-vihar-001",
 "status": "done",
 "building": {
  "roof_area_m2": 238.8,
  "usable_area_m2": 77.5
 },
 "system": {
  "panel_count": 30,
  "panel_wp": 540,
  "kw_dc": 16.2,
  "tilt_deg": 25,
  "azimuth_deg": 180
 },
 "panels": {
  "type": "FeatureCollection",
  "features": [
   {
    "type": "Feature",
    "geometry": {
     "type": "Polygon",
     "coordinates": [
      [
       [
        77.2935201,
        28.6038951
       ],
       [
        77.2935317,
        28.6038951
       ],
       [
        77.2935317,
        28.6039136
       ],
       [
        77.2935201,
        28.6039136
       ],
       [
        77.2935201,
        28.6038951
       ]
      ]
     ]
    },
    "properties": {
     "id": "p1",
     "shade_fraction": 0.04
    }
   },
   {
    "type": "Feature",
    "geometry": {
     "type": "Polygon",
     "coordinates": [
      [
       [
        77.2935038,
        28.6039292
       ],
       [
        77.2935154,
        28.6039292
       ],
       [
        77.2935154,
        28.6039478
       ],
       [
        77.2935038,
        28.6039478
       ],
       [
        77.2935038,
        28.6039292
       ]
      ]
     ]
    },
    "properties": {
     "id": "p2",
     "shade_fraction": 0.04
    }
   },
   {
    "type": "Feature",
    "geometry": {
     "type": "Polygon",
     "coordinates": [
      [
       [
        77.2935154,
        28.6039292
       ],
       [
        77.293527,
        28.6039292
       ],
       [
        77.293527,
        28.6039478
       ],
       [
        77.2935154,
        28.6039478
       ],
       [
        77.2935154,
        28.6039292
       ]
      ]
     ]
    },
    "properties": {
     "id": "p3",
     "shade_fraction": 0.04
    }
   },
   {
    "type": "Feature",
    "geometry": {
     "type": "Polygon",
     "coordinates": [
      [
       [
        77.293527,
        28.6039292
       ],
       [
        77.2935386,
        28.6039292
       ],
       [
        77.2935386,
        28.6039478
       ],
       [
        77.293527,
        28.6039478
       ],
       [
        77.293527,
        28.6039292
       ]
      ]
     ]
    },
    "properties": {
     "id": "p4",
     "shade_fraction": 0.04
    }
   },
   {
    "type": "Feature",
    "geometry": {
     "type": "Polygon",
     "coordinates": [
      [
       [
        77.2935386,
        28.6039292
       ],
       [
        77.2935502,
        28.6039292
       ],
       [
        77.2935502,
        28.6039478
       ],
       [
        77.2935386,
        28.6039478
       ],
       [
        77.2935386,
        28.6039292
       ]
      ]
     ]
    },
    "properties": {
     "id": "p5",
     "shade_fraction": 0.04
    }
   },
   {
    "type": "Feature",
    "geometry": {
     "type": "Polygon",
     "coordinates": [
      [
       [
        77.2935502,
        28.6039292
       ],
       [
        77.2935618,
        28.6039292
       ],
       [
        77.2935618,
        28.6039478
       ],
       [
        77.2935502,
        28.6039478
       ],
       [
        77.2935502,
        28.6039292
       ]
      ]
     ]
    },
    "properties": {
     "id": "p6",
     "shade_fraction": 0.04
    }
   },
   {
    "type": "Feature",
    "geometry": {
     "type": "Polygon",
     "coordinates": [
      [
       [
        77.2935618,
        28.6039292
       ],
       [
        77.2935734,
        28.6039292
       ],
       [
        77.2935734,
        28.6039478
       ],
       [
        77.2935618,
        28.6039478
       ],
       [
        77.2935618,
        28.6039292
       ]
      ]
     ]
    },
    "properties": {
     "id": "p7",
     "shade_fraction": 0.04
    }
   },
   {
    "type": "Feature",
    "geometry": {
     "type": "Polygon",
     "coordinates": [
      [
       [
        77.2935734,
        28.6039292
       ],
       [
        77.293585,
        28.6039292
       ],
       [
        77.293585,
        28.6039478
       ],
       [
        77.2935734,
        28.6039478
       ],
       [
        77.2935734,
        28.6039292
       ]
      ]
     ]
    },
    "properties": {
     "id": "p8",
     "shade_fraction": 0.04
    }
   },
   {
    "type": "Feature",
    "geometry": {
     "type": "Polygon",
     "coordinates": [
      [
       [
        77.293585,
        28.6039292
       ],
       [
        77.2935966,
        28.6039292
       ],
       [
        77.2935966,
        28.6039478
       ],
       [
        77.293585,
        28.6039478
       ],
       [
        77.293585,
        28.6039292
       ]
      ]
     ]
    },
    "properties": {
     "id": "p9",
     "shade_fraction": 0.04
    }
   },
   {
    "type": "Feature",
    "geometry": {
     "type": "Polygon",
     "coordinates": [
      [
       [
        77.2935966,
        28.6039292
       ],
       [
        77.2936082,
        28.6039292
       ],
       [
        77.2936082,
        28.6039478
       ],
       [
        77.2935966,
        28.6039478
       ],
       [
        77.2935966,
        28.6039292
       ]
      ]
     ]
    },
    "properties": {
     "id": "p10",
     "shade_fraction": 0.04
    }
   },
   {
    "type": "Feature",
    "geometry": {
     "type": "Polygon",
     "coordinates": [
      [
       [
        77.2934874,
        28.6039633
       ],
       [
        77.293499,
        28.6039633
       ],
       [
        77.293499,
        28.6039819
       ],
       [
        77.2934874,
        28.6039819
       ],
       [
        77.2934874,
        28.6039633
       ]
      ]
     ]
    },
    "properties": {
     "id": "p11",
     "shade_fraction": 0.04
    }
   },
   {
    "type": "Feature",
    "geometry": {
     "type": "Polygon",
     "coordinates": [
      [
       [
        77.293499,
        28.6039633
       ],
       [
        77.2935106,
        28.6039633
       ],
       [
        77.2935106,
        28.6039819
       ],
       [
        77.293499,
        28.6039819
       ],
       [
        77.293499,
        28.6039633
       ]
      ]
     ]
    },
    "properties": {
     "id": "p12",
     "shade_fraction": 0.04
    }
   },
   {
    "type": "Feature",
    "geometry": {
     "type": "Polygon",
     "coordinates": [
      [
       [
        77.2935106,
        28.6039633
       ],
       [
        77.2935222,
        28.6039633
       ],
       [
        77.2935222,
        28.6039819
       ],
       [
        77.2935106,
        28.6039819
       ],
       [
        77.2935106,
        28.6039633
       ]
      ]
     ]
    },
    "properties": {
     "id": "p13",
     "shade_fraction": 0.04
    }
   },
   {
    "type": "Feature",
    "geometry": {
     "type": "Polygon",
     "coordinates": [
      [
       [
        77.2935222,
        28.6039633
       ],
       [
        77.2935338,
        28.6039633
       ],
       [
        77.2935338,
        28.6039819
       ],
       [
        77.2935222,
        28.6039819
       ],
       [
        77.2935222,
        28.6039633
       ]
      ]
     ]
    },
    "properties": {
     "id": "p14",
     "shade_fraction": 0.04
    }
   },
   {
    "type": "Feature",
    "geometry": {
     "type": "Polygon",
     "coordinates": [
      [
       [
        77.2935338,
        28.6039633
       ],
       [
        77.2935454,
        28.6039633
       ],
       [
        77.2935454,
        28.6039819
       ],
       [
        77.2935338,
        28.6039819
       ],
       [
        77.2935338,
        28.6039633
       ]
      ]
     ]
    },
    "properties": {
     "id": "p15",
     "shade_fraction": 0.04
    }
   },
   {
    "type": "Feature",
    "geometry": {
     "type": "Polygon",
     "coordinates": [
      [
       [
        77.2935454,
        28.6039633
       ],
       [
        77.293557,
        28.6039633
       ],
       [
        77.293557,
        28.6039819
       ],
       [
        77.2935454,
        28.6039819
       ],
       [
        77.2935454,
        28.6039633
       ]
      ]
     ]
    },
    "properties": {
     "id": "p16",
     "shade_fraction": 0.04
    }
   },
   {
    "type": "Feature",
    "geometry": {
     "type": "Polygon",
     "coordinates": [
      [
       [
        77.293557,
        28.6039633
       ],
       [
        77.2935686,
        28.6039633
       ],
       [
        77.2935686,
        28.6039819
       ],
       [
        77.293557,
        28.6039819
       ],
       [
        77.293557,
        28.6039633
       ]
      ]
     ]
    },
    "properties": {
     "id": "p17",
     "shade_fraction": 0.04
    }
   },
   {
    "type": "Feature",
    "geometry": {
     "type": "Polygon",
     "coordinates": [
      [
       [
        77.2935686,
        28.6039633
       ],
       [
        77.2935802,
        28.6039633
       ],
       [
        77.2935802,
        28.6039819
       ],
       [
        77.2935686,
        28.6039819
       ],
       [
        77.2935686,
        28.6039633
       ]
      ]
     ]
    },
    "properties": {
     "id": "p18",
     "shade_fraction": 0.04
    }
   },
   {
    "type": "Feature",
    "geometry": {
     "type": "Polygon",
     "coordinates": [
      [
       [
        77.2935802,
        28.6039633
       ],
       [
        77.2935918,
        28.6039633
       ],
       [
        77.2935918,
        28.6039819
       ],
       [
        77.2935802,
        28.6039819
       ],
       [
        77.2935802,
        28.6039633
       ]
      ]
     ]
    },
    "properties": {
     "id": "p19",
     "shade_fraction": 0.04
    }
   },
   {
    "type": "Feature",
    "geometry": {
     "type": "Polygon",
     "coordinates": [
      [
       [
        77.293471,
        28.6039975
       ],
       [
        77.2934826,
        28.6039975
       ],
       [
        77.2934826,
        28.604016
       ],
       [
        77.293471,
        28.604016
       ],
       [
        77.293471,
        28.6039975
       ]
      ]
     ]
    },
    "properties": {